tags,image,title,description,demolink,externallink,more
fall2020 semester-project demo,Project Drillbit.png,Project DrillBit,Led by Connor Lantz,aub.ie/drillbit,,An open tower-defence game set within an alien cave system. Fight off wave after wave of bug monsters while protecting your resource collectors.
fall2018 semester-project demo,Project Ignition.png,Project Ignition,Led by Connor Lantz,https://lantzel0t.itch.io/project-ignition,,"In this game, your fuel is your weapon. Drop pools of flammable gasoline behind you, and then run back over it to set it ablaze! Be sure to keep an eye on your gas gauge and find a gas pump when it gets too low. With a Mad Max inspired theme and Tron-like game-play, driving through a scarred wasteland has never been more fun."
spring2018 summer game-jam demo,Outlast Island.png,Outlast Island,Connor Lantz,https://lantzel0t.itch.io/outlast-island,,"A co-op or single-player survival game with four different playable characters. Stranded on an island, you must fortify yourself during the day from the creatures that come out at night. This game features a full building system, algorithm-generated enemy waves, four different playable characters, six different monster types, and a levelling system."
spring2018 semester-project,HipHopper.gif,HipHopper,Team Hopper: Led by Christian Graham,,https://christiangraham.org/#/hip-hopper/,"Hip Hopper is a first person platformer inspired by mascot platformers of the N64/PS1/PS2 era. The idea was to take a 3D Mario open world and reimagine it with the movement mechanics of Mirrors Edge. The objective is to make a demo in which we showcase the movement mechanics, how they play into the design of the world, and an original hip hop score to tie it together. Hip Hopper features wall jumping, wall climbing, and wall running in an interconnected world."
fall2017 winter game-jam demo,Icebound.gif,Icebound,Connor Lantz,https://lantzel0t.itch.io/icebound,,"Icy point-and click adventure game with low-poly 3D visuals, reminiscent of LucasArts point-and-click games."
fall2017 intro game-jam demo,Spooky Spells.gif,Spooky Spells,Connor Lantz,https://lantzel0t.itch.io/spooky-spells,,
